{
  "schema": "agoragentic.interchange-production-research-ledger.v1",
  "generated_at": "2026-08-14T20:00:26Z",
  "program": {
    "name": "Agent Commerce Interchange",
    "charter_url": "https://github.com/rhein1/agent-marketplace/issues/520",
    "charter_opened_at": "2026-06-08T22:23:44Z",
    "successor_gate_url": "https://github.com/rhein1/agent-marketplace/issues/1100",
    "scope_start": "2026-06-08",
    "scope_end": "2026-08-14"
  },
  "evidence_levels": [
    "source_merged",
    "deployed",
    "activated",
    "first_party_exercised",
    "recruited_external_exercised",
    "independent_external_exercised",
    "organic_adoption",
    "repeat_adoption",
    "revenue"
  ],
  "external_experiments": [
    {
      "id": "outbound-x402-external-seller-2026-06-14",
      "title": "First-party canary pays external x402 seller",
      "started_at": "2026-06-14T16:32:13Z",
      "completed_at": "2026-06-14T16:32:13Z",
      "time_precision": "second",
      "actor_class": "mixed",
      "economic_class": "test_money",
      "evidence_level": "first_party_exercised",
      "result": "A platform-controlled buyer settled 0.005 USDC to a third-party x402 seller on Base; the historical Interchange receipt was unsigned and is not used as signed proof.",
      "authority_after": {
        "contact": false,
        "invoke": false,
        "routing": false,
        "referrals": false,
        "provider_execution": false,
        "money": false,
        "trust_promotion": false
      },
      "evidence": [
        {
          "kind": "base_transaction",
          "url": "https://basescan.org/tx/0x9b01b4b465e1a764182f796095923fb341608175b01752d6b80631b779bb7d44",
          "ref": "0x9b01b4b465e1a764182f796095923fb341608175b01752d6b80631b779bb7d44"
        },
        {
          "kind": "merged_source",
          "url": "https://github.com/rhein1/agent-marketplace/pull/672",
          "ref": "PR-672"
        }
      ],
      "limitations": [
        "The buyer was controlled by Agoragentic.",
        "The run proves outbound settlement, not external buyer demand.",
        "The historical receipt was unsigned and is not used as independently verifiable receipt evidence."
      ],
      "chain_evidence": {
        "network": "eip155:8453",
        "tx_hash": "0x9b01b4b465e1a764182f796095923fb341608175b01752d6b80631b779bb7d44",
        "block_number": 47332693,
        "timestamp": "2026-06-14T16:32:13Z",
        "asset_contract": "0x833589fCD6eDb6E08f4c7C32D4f71b54bdA02913",
        "amount_atomic": "5000",
        "amount_display": "0.005 USDC",
        "from": "0xdfEef7b41F2F677122899F55Df45a6D708386C8A",
        "to": "0x52E29e0d2Aa49bfBfC548C0A9F2196F4aa51f3ea",
        "status": "success"
      }
    },
    {
      "id": "governed-internal-balance-pilot-2026-07",
      "title": "Recruited external agent completes governed lifecycle with owner-seeded balance",
      "started_at": "2026-07-08",
      "completed_at": "2026-07-12",
      "time_precision": "day",
      "actor_class": "recruited_external",
      "economic_class": "owner_seeded",
      "evidence_level": "recruited_external_exercised",
      "result": "The recruited external agent reached RECONCILED with a signed receipt using an owner-seeded internal balance and a first-party capability.",
      "authority_after": {
        "contact": false,
        "invoke": false,
        "routing": false,
        "referrals": false,
        "provider_execution": false,
        "money": false,
        "trust_promotion": false
      },
      "evidence": [
        {
          "kind": "living_adoption_gate",
          "url": "https://github.com/rhein1/agent-marketplace/issues/1100",
          "note": "Public-safe summary; private receipt fields are not reproduced in this ledger."
        },
        {
          "kind": "merged_source",
          "url": "https://github.com/rhein1/agent-marketplace/pull/991",
          "ref": "PR-991"
        },
        {
          "kind": "merged_source",
          "url": "https://github.com/rhein1/agent-marketplace/pull/996",
          "ref": "PR-996"
        }
      ],
      "limitations": [
        "The counterparty was recruited.",
        "The balance was seeded by the owner.",
        "The capability was first-party, so the economic loop was not external revenue."
      ]
    },
    {
      "id": "modern-caip2-own-wallet-pilot-2026-07-12",
      "title": "Recruited external operator settles with an unmodified modern EVM x402 client",
      "started_at": "2026-07-12T20:06:07Z",
      "completed_at": "2026-07-12T20:06:07Z",
      "time_precision": "second",
      "actor_class": "recruited_external",
      "economic_class": "external_test_money",
      "evidence_level": "recruited_external_exercised",
      "result": "An unmodified modern EVM x402 client paid 0.01 USDC from the recruited operator's wallet through the isolated CAIP-2 endpoint; the governed production path completed according to the operator record.",
      "authority_after": {
        "contact": false,
        "invoke": false,
        "routing": false,
        "referrals": false,
        "provider_execution": false,
        "money": false,
        "trust_promotion": false
      },
      "evidence": [
        {
          "kind": "base_transaction",
          "url": "https://basescan.org/tx/0x705c7a146774289c9e26aea991eac31c82bede037f497b4994bf3d32bbcc6e95",
          "ref": "0x705c7a146774289c9e26aea991eac31c82bede037f497b4994bf3d32bbcc6e95"
        },
        {
          "kind": "merged_source",
          "url": "https://github.com/rhein1/agent-marketplace/pull/1008",
          "ref": "PR-1008"
        }
      ],
      "limitations": [
        "The counterparty was recruited.",
        "The payment was a controlled test, not organic demand.",
        "The chain receipt alone does not prove the application identity or receipt signature."
      ],
      "chain_evidence": {
        "network": "eip155:8453",
        "tx_hash": "0x705c7a146774289c9e26aea991eac31c82bede037f497b4994bf3d32bbcc6e95",
        "block_number": 48548710,
        "timestamp": "2026-07-12T20:06:07Z",
        "asset_contract": "0x833589fCD6eDb6E08f4c7C32D4f71b54bdA02913",
        "amount_atomic": "10000",
        "amount_display": "0.01 USDC",
        "from": "0x7818cB9cEad1E13E64A259F0867089dB75E374c5",
        "to": "0xadB33740Ac38c8F6721100Ff813ab91d958670BC",
        "status": "success"
      }
    },
    {
      "id": "anchor-key-control-2026-07",
      "title": "Anchor reciprocal Ed25519 key-control pilot",
      "started_at": "2026-07-20",
      "completed_at": "2026-07-21",
      "time_precision": "day",
      "actor_class": "independent_external",
      "economic_class": "no_money",
      "evidence_level": "independent_external_exercised",
      "result": "Both operators completed owner-reviewed TOFU key control for relationship anchor-x402-pilot-2026-07 using dedicated federation identity keys.",
      "authority_after": {
        "contact": false,
        "invoke": false,
        "routing": false,
        "referrals": false,
        "provider_execution": false,
        "money": false,
        "trust_promotion": false
      },
      "evidence": [
        {
          "kind": "public_pilot_record",
          "url": "https://github.com/rhein1/agoragentic-integrations/blob/main/interchange/ANCHOR_X402_PILOT.md"
        },
        {
          "kind": "machine_evidence",
          "url": "https://github.com/rhein1/agoragentic-integrations/blob/main/interchange/evidence/anchor-x402-pilot-2026-07.json"
        }
      ],
      "limitations": [
        "TOFU key control is not legal identity verification.",
        "The relationship grants no execution, routing, referral, trust, or payment authority."
      ]
    },
    {
      "id": "anchor-capability-exchange-2026-07",
      "title": "Anchor bounded public capability exchange",
      "started_at": "2026-07-22T22:35:53.495Z",
      "completed_at": "2026-07-23T22:35:53.495Z",
      "time_precision": "second",
      "actor_class": "independent_external",
      "economic_class": "no_money",
      "evidence_level": "independent_external_exercised",
      "result": "Two operators exchanged and refreshed public Agent Card/catalog metadata within explicit budgets, reproduced retained hashes, discarded raw bodies, and closed the feed at expiry.",
      "authority_after": {
        "contact": false,
        "invoke": false,
        "routing": false,
        "referrals": false,
        "provider_execution": false,
        "money": false,
        "trust_promotion": false
      },
      "evidence": [
        {
          "kind": "public_pilot_record",
          "url": "https://github.com/rhein1/agoragentic-integrations/blob/main/interchange/ANCHOR_X402_PILOT.md"
        },
        {
          "kind": "counterparty_consent_record",
          "url": "https://github.com/rhein1/agent-marketplace/issues/1100#issuecomment-5048591967"
        }
      ],
      "limitations": [
        "Only public metadata was exchanged.",
        "No task, provider, routing, referral, payment, or private-data path was exercised.",
        "One independent pilot does not establish broad protocol adoption."
      ]
    },
    {
      "id": "bounded-a2a-outreach-observation-2026-07-21-to-2026-08-04",
      "title": "Bounded autonomous A2A first-contact observation",
      "started_at": "2026-07-21",
      "completed_at": "2026-08-04",
      "time_precision": "day",
      "actor_class": "mixed",
      "economic_class": "no_money",
      "evidence_level": "deployed",
      "result": "Three pre-fix first contacts produced no valid engagement; seven intended post-fix windows produced zero eligible sends because candidates lacked consent, compatible protocol bindings, valid cards/origins, reachability, or cooldown eligibility.",
      "authority_after": {
        "contact": false,
        "invoke": false,
        "routing": false,
        "referrals": false,